{
    "contract_version": "1.0.0",
    "specification_version": "1.0-draft.1",
    "input": {
        "kind": "source",
        "document": {
            "contract_version": "1.0.0",
            "source_id": "src:protocol.regex-portability",
            "specification_version": "1.0-draft.1",
            "frontend": {
                "id": "strling.regex-compat",
                "dialect_version": "1.0.0"
            },
            "content": { "kind": "inline", "encoding": "utf-8", "text": "a" },
            "provenance": { "kind": "imported" }
        }
    },
    "target_profile": {
        "profile_id": "profile:pcre2/10.43",
        "profile_version": "1.3.0",
        "sha256": "56762a1d289d41d0811b007695464916fda0ca5c48c2f5569b4ec26983a24bff"
    },
    "requested_outputs": ["semantic", "portability"],
    "compiler_options": {
        "partial_semantics": "forbid",
        "diagnostic_policy": { "minimum_severity": "hint" }
    }
}
